{
  "schema_version": 2,
  "snapshot_date": "2026-10-13",
  "git_head": "eb1fe0e932967ce97078df12c8080cf5121c99b4",
  "history": {
    "path": "Docs/Implementation/PluginDemos/History/PluginDemoManifest.v1.json",
    "git_revision": "eb1fe0e932967ce97078df12c8080cf5121c99b4",
    "sha256": "b312fcf0e94fb2ac3d41e36c8b6c7ee12671053fecca2728e3a50df4c4f7749c"
  },
  "plugins": [
    {
      "plugin_id": "MobaPresentation",
      "descriptor_path": "Game/Plugins/MobaCommon/Presentation/MobaPresentation/MobaPresentation.uplugin",
      "architecture_layer": "Moba",
      "plugin_kind": "code",
      "feature_audit_status": "unreviewed"
    },
    {
      "plugin_id": "GamePlatformSession",
      "descriptor_path": "Game/Plugins/GamePlatform/OnlineServices/GamePlatformSession/GamePlatformSession.uplugin",
      "architecture_layer": "Platform",
      "plugin_kind": "code",
      "feature_audit_status": "unreviewed"
    },
    {
      "plugin_id": "GamePlatformCommerceUI",
      "descriptor_path": "Game/Plugins/GamePlatform/PlayerServices/GamePlatformCommerceUI/GamePlatformCommerceUI.uplugin",
      "architecture_layer": "Platform",
      "plugin_kind": "code",
      "feature_audit_status": "unreviewed"
    },
    {
      "plugin_id": "GamePlatformServer",
      "descriptor_path": "Game/Plugins/GamePlatform/OnlineServices/GamePlatformServer/GamePlatformServer.uplugin",
      "architecture_layer": "Platform",
      "plugin_kind": "code",
      "feature_audit_status": "unreviewed"
    },
    {
      "plugin_id": "DBAArena",
      "descriptor_path": "Game/Plugins/DivineBeasts/DBAArena/DBAArena.uplugin",
      "architecture_layer": "Project",
      "plugin_kind": "code",
      "feature_audit_status": "unreviewed"
    },
    {
      "plugin_id": "DBAClient",
      "descriptor_path": "Game/Plugins/DivineBeasts/DBAClient/DBAClient.uplugin",
      "architecture_layer": "Project",
      "plugin_kind": "code",
      "feature_audit_status": "partial"
    },
    {
      "plugin_id": "DBAContentPack_Common",
      "descriptor_path": "Game/Plugins/DivineBeasts/ContentPacks/Common/DBAContentPack_Common/DBAContentPack_Common.uplugin",
      "architecture_layer": "Project",
      "plugin_kind": "content_pack",
      "feature_audit_status": "unreviewed"
    },
    {
      "plugin_id": "DBASFXPack_Core",
      "descriptor_path": "Game/Plugins/DivineBeasts/ContentPacks/Presentation/DBASFXPack_Core/DBASFXPack_Core.uplugin",
      "architecture_layer": "Project",
      "plugin_kind": "content_pack",
      "feature_audit_status": "unreviewed"
    },
    {
      "plugin_id": "GamePlatformAnimation",
      "descriptor_path": "Game/Plugins/GamePlatform/Gameplay/GamePlatformAnimation/GamePlatformAnimation.uplugin",
      "architecture_layer": "Platform",
      "plugin_kind": "code",
      "feature_audit_status": "unreviewed"
    },
    {
      "plugin_id": "GamePlatformOnline",
      "descriptor_path": "Game/Plugins/GamePlatform/OnlineServices/GamePlatformOnline/GamePlatformOnline.uplugin",
      "architecture_layer": "Platform",
      "plugin_kind": "code",
      "feature_audit_status": "unreviewed"
    },
    {
      "plugin_id": "GamePlatformAI",
      "descriptor_path": "Game/Plugins/GamePlatform/Gameplay/GamePlatformAI/GamePlatformAI.uplugin",
      "architecture_layer": "Platform",
      "plugin_kind": "code",
      "feature_audit_status": "unreviewed"
    },
    {
      "plugin_id": "GamePlatformAbilitySystem",
      "descriptor_path": "Game/Plugins/GamePlatform/Gameplay/GamePlatformAbilitySystem/GamePlatformAbilitySystem.uplugin",
      "architecture_layer": "Platform",
      "plugin_kind": "code",
      "feature_audit_status": "unreviewed"
    },
    {
      "plugin_id": "DBAUIPack_Core",
      "descriptor_path": "Game/Plugins/DivineBeasts/ContentPacks/Presentation/DBAUIPack_Core/DBAUIPack_Core.uplugin",
      "architecture_layer": "Project",
      "plugin_kind": "content_pack",
      "feature_audit_status": "unreviewed"
    },
    {
      "plugin_id": "DBAHeroPack_Tiger",
      "descriptor_path": "Game/Plugins/DivineBeasts/ContentPacks/Heroes/DBAHeroPack_Tiger/DBAHeroPack_Tiger.uplugin",
      "architecture_layer": "Project",
      "plugin_kind": "content_pack",
      "feature_audit_status": "unreviewed"
    },
    {
      "plugin_id": "GamePlatformGameplay",
      "descriptor_path": "Game/Plugins/GamePlatform/Gameplay/GamePlatformGameplay/GamePlatformGameplay.uplugin",
      "architecture_layer": "Platform",
      "plugin_kind": "code",
      "feature_audit_status": "unreviewed"
    },
    {
      "plugin_id": "GamePlatformQuest",
      "descriptor_path": "Game/Plugins/GamePlatform/Gameplay/GamePlatformQuest/GamePlatformQuest.uplugin",
      "architecture_layer": "Platform",
      "plugin_kind": "code",
      "feature_audit_status": "unreviewed"
    },
    {
      "plugin_id": "DBAFrontEndPack",
      "descriptor_path": "Game/Plugins/DivineBeasts/ContentPacks/Presentation/DBAFrontEndPack/DBAFrontEndPack.uplugin",
      "architecture_layer": "Project",
      "plugin_kind": "content_pack",
      "feature_audit_status": "unreviewed"
    },
    {
      "plugin_id": "DBAWorldPack_Village",
      "descriptor_path": "Game/Plugins/DivineBeasts/ContentPacks/Worlds/DBAWorldPack_Village/DBAWorldPack_Village.uplugin",
      "architecture_layer": "Project",
      "plugin_kind": "content_pack",
      "feature_audit_status": "unreviewed"
    },
    {
      "plugin_id": "DBAHeroPack_Snake",
      "descriptor_path": "Game/Plugins/DivineBeasts/ContentPacks/Heroes/DBAHeroPack_Snake/DBAHeroPack_Snake.uplugin",
      "architecture_layer": "Project",
      "plugin_kind": "content_pack",
      "feature_audit_status": "unreviewed"
    },
    {
      "plugin_id": "GamePlatformCharacter",
      "descriptor_path": "Game/Plugins/GamePlatform/Gameplay/GamePlatformCharacter/GamePlatformCharacter.uplugin",
      "architecture_layer": "Platform",
      "plugin_kind": "code",
      "feature_audit_status": "unreviewed"
    },
    {
      "plugin_id": "GamePlatformCombat",
      "descriptor_path": "Game/Plugins/GamePlatform/Gameplay/GamePlatformCombat/GamePlatformCombat.uplugin",
      "architecture_layer": "Platform",
      "plugin_kind": "code",
      "feature_audit_status": "unreviewed"
    },
    {
      "plugin_id": "DBAPresentationPack_Core",
      "descriptor_path": "Game/Plugins/DivineBeasts/ContentPacks/Presentation/DBAPresentationPack_Core/DBAPresentationPack_Core.uplugin",
      "architecture_layer": "Project",
      "plugin_kind": "content_pack",
      "feature_audit_status": "unreviewed"
    },
    {
      "plugin_id": "DBAHeroPack_Ox",
      "descriptor_path": "Game/Plugins/DivineBeasts/ContentPacks/Heroes/DBAHeroPack_Ox/DBAHeroPack_Ox.uplugin",
      "architecture_layer": "Project",
      "plugin_kind": "content_pack",
      "feature_audit_status": "unreviewed"
    },
    {
      "plugin_id": "DBAHeroPack_Dog",
      "descriptor_path": "Game/Plugins/DivineBeasts/ContentPacks/Heroes/DBAHeroPack_Dog/DBAHeroPack_Dog.uplugin",
      "architecture_layer": "Project",
      "plugin_kind": "content_pack",
      "feature_audit_status": "unreviewed"
    },
    {
      "plugin_id": "DBAHeroPack_Dragon",
      "descriptor_path": "Game/Plugins/DivineBeasts/ContentPacks/Heroes/DBAHeroPack_Dragon/DBAHeroPack_Dragon.uplugin",
      "architecture_layer": "Project",
      "plugin_kind": "content_pack",
      "feature_audit_status": "unreviewed"
    },
    {
      "plugin_id": "DBAHeroPack_Boar",
      "descriptor_path": "Game/Plugins/DivineBeasts/ContentPacks/Heroes/DBAHeroPack_Boar/DBAHeroPack_Boar.uplugin",
      "architecture_layer": "Project",
      "plugin_kind": "content_pack",
      "feature_audit_status": "unreviewed"
    },
    {
      "plugin_id": "DBAHeroPack_Rooster",
      "descriptor_path": "Game/Plugins/DivineBeasts/ContentPacks/Heroes/DBAHeroPack_Rooster/DBAHeroPack_Rooster.uplugin",
      "architecture_layer": "Project",
      "plugin_kind": "content_pack",
      "feature_audit_status": "unreviewed"
    },
    {
      "plugin_id": "DBAHeroPack_Horse",
      "descriptor_path": "Game/Plugins/DivineBeasts/ContentPacks/Heroes/DBAHeroPack_Horse/DBAHeroPack_Horse.uplugin",
      "architecture_layer": "Project",
      "plugin_kind": "content_pack",
      "feature_audit_status": "unreviewed"
    },
    {
      "plugin_id": "DBAHeroPack_Goat",
      "descriptor_path": "Game/Plugins/DivineBeasts/ContentPacks/Heroes/DBAHeroPack_Goat/DBAHeroPack_Goat.uplugin",
      "architecture_layer": "Project",
      "plugin_kind": "content_pack",
      "feature_audit_status": "unreviewed"
    },
    {
      "plugin_id": "DBAHeroPack_Rat",
      "descriptor_path": "Game/Plugins/DivineBeasts/ContentPacks/Heroes/DBAHeroPack_Rat/DBAHeroPack_Rat.uplugin",
      "architecture_layer": "Project",
      "plugin_kind": "content_pack",
      "feature_audit_status": "unreviewed"
    },
    {
      "plugin_id": "GamePlatformUI",
      "descriptor_path": "Game/Plugins/GamePlatform/Presentation/GamePlatformUI/GamePlatformUI.uplugin",
      "architecture_layer": "Platform",
      "plugin_kind": "code",
      "feature_audit_status": "partial"
    },
    {
      "plugin_id": "DBAHeroPack_Monkey",
      "descriptor_path": "Game/Plugins/DivineBeasts/ContentPacks/Heroes/DBAHeroPack_Monkey/DBAHeroPack_Monkey.uplugin",
      "architecture_layer": "Project",
      "plugin_kind": "content_pack",
      "feature_audit_status": "unreviewed"
    },
    {
      "plugin_id": "GamePlatformEquipment",
      "descriptor_path": "Game/Plugins/GamePlatform/PlayerServices/GamePlatformEquipment/GamePlatformEquipment.uplugin",
      "architecture_layer": "Platform",
      "plugin_kind": "code",
      "feature_audit_status": "unreviewed"
    },
    {
      "plugin_id": "GamePlatformNavigation",
      "descriptor_path": "Game/Plugins/GamePlatform/World/GamePlatformNavigation/GamePlatformNavigation.uplugin",
      "architecture_layer": "Platform",
      "plugin_kind": "code",
      "feature_audit_status": "unreviewed"